{
 "geometry": {
  "lateral_mm": 10.0,
  "layers": [
   {
    "repeat": 1,
    "slabs": [
     {
      "material": "Si_study",
      "name": "Si",
      "sensitive": true,
      "thickness_mm": 0.3
     }
    ]
   }
  ],
  "world": {
   "material": "G4_Galactic",
   "scale": 1.2
  }
 },
 "gun": {
  "direction": [
   1,
   0,
   0
  ],
  "energy_MeV": 10000.0,
  "particle": "mu-",
  "world_fraction": -0.499
 },
 "materials": [
  {
   "a_g_mole": 28.0855,
   "density_g_cm3": 2.329,
   "name": "Si_study",
   "source": "PDG Atomic and Nuclear Properties, silicon (2024): A = 28.0855(3) g/mol, density 2.329 g/cm3",
   "z": 14
  }
 ],
 "note": "J14: 10 GeV mu- through 300 um of silicon (EM-only, option 4)",
 "output": {
  "overlap_test_points": 1000
 },
 "physics": {
  "decay": true,
  "default_cut_mm": 0.01,
  "em_constructor": "G4EmStandardPhysics_option4",
  "regions": [
   {
    "cut_mm": 0.01,
    "name": "SiRegion",
    "slabs": [
     "Si"
    ]
   }
  ]
 },
 "run": {
  "events": 64000,
  "run_manager": "serial",
  "seeds": [
   1587055842,
   222476076
  ]
 },
 "schema": "layered_sim.spec/1",
 "ui_commands": []
}
