{
 "schema": "layered_sim.spec/1",
 "note": "Negative control of the overlap check (WP1 check 1): the lAr slab is shifted 1 mm upstream into its Pb neighbour.",
 "geometry": {
  "lateral_mm": 400.0,
  "layers": [
   {
    "repeat": 1,
    "slabs": [
     {
      "name": "Pb",
      "material": "G4_Pb",
      "thickness_mm": 2.3,
      "sensitive": true
     },
     {
      "name": "lAr",
      "material": "G4_lAr",
      "thickness_mm": 5.7,
      "sensitive": true,
      "shift_mm": -1.0
     }
    ]
   }
  ],
  "world": {
   "material": "Galactic",
   "scale": 1.2
  }
 },
 "materials": [
  {
   "name": "Galactic",
   "z": 1,
   "a_g_mole": 1.008,
   "density_g_cm3": 1e-25,
   "state": "gas",
   "temperature_K": 2.73,
   "pressure_Pa": 3e-18
  }
 ],
 "physics": {
  "em_constructor": "G4EmStandardPhysics",
  "decay": true,
  "default_cut_mm": 1.0
 },
 "ui_commands": [],
 "gun": {
  "particle": "e-",
  "energy_MeV": 1000.0,
  "world_fraction": -0.499,
  "direction": [
   1,
   0,
   0
  ]
 },
 "run": {
  "events": 10,
  "seeds": [
   12345,
   67890
  ],
  "run_manager": "serial"
 },
 "output": {
  "overlap_test_points": 1000
 }
}
